{"canaryId":"tidycell-phase-b-stratified-canary-v1","completionStatus":"frozen-no-copy","coverage":{"copyEligibleItemCount":58,"countsByArtifactClass":{"approval-registry":1,"catalog-evidence":2,"development-subtree":1,"example-operation-evidence":4,"generated-development-symlink":1,"generation-json-evidence":2,"generation-source-code":5,"harvest-evidence":7,"ml-evidence":6,"model-binary":2,"os-editor-metadata":1,"recipe-evidence":4,"research-evidence":16,"secret-or-local-configuration":1,"unselected-source-file":1,"workbook":5,"workbook-estate-evidence":4},"countsByDisposition":{"duplicate-alias":22,"exclude":5,"import":36},"countsByEntryType":{"excluded-subtree":1,"excluded-symlink":1,"file":61},"countsByGitState":{"ignored":30,"tracked":31,"untracked":2},"duplicateAliasCount":22,"duplicateGroupCount":20,"embeddedKindCounts":{"prompt-evidence":1,"provider-response-evidence":1,"recipe-candidate":4,"recipe-document":4},"embeddedRecordCount":1011,"fileCount":61,"itemCount":63,"sizeBucketCounts":{"empty":1,"large":4,"medium":35,"small":21},"sourceReadBytes":44084669,"uniqueCopyBytes":42423291,"uniqueCopyObjectCount":36,"warningCounts":{"EMBEDDED_SCAN_RECORD_LIMIT":1,"EMBEDDED_SCAN_SKIPPED_SIZE":1,"SYMLINK_NOT_FOLLOWED":1,"WORKBOOK_EXTENSION_FORMAT_MISMATCH":1}},"duplicateGroups":[{"artifactClasses":["research-evidence"],"canonicalImportPath":"research-runs/prompt-efficiency/004-static-prefix-compression/static-prefix-size-pass/quality/core-rules/recipes/ABS_LEGALASSISTANCE_2023-24_00_02_04__core-rules__repeat_3.json","contentDigest":"sha256:01adc045bb6fd70423367b70a39bcf6f2bade3c298efa67d16b92707b7c26f4a","dispositions":["duplicate-alias","import"],"groupSizeInSnapshot":2,"selectedMemberCount":2,"selectedPaths":["research-runs/prompt-efficiency/004-static-prefix-compression/static-prefix-size-pass/quality/core-rules/recipes/ABS_LEGALASSISTANCE_2023-24_00_02_04__core-rules__repeat_3.json","research-runs/prompt-efficiency/024-model-effort-revision-grid/prompt-efficiency-024-model-effort-revision-grid/quality/efficiency-winners__deepseek-deepseek-v4-pro__default__off__review-always-2-repair/recipes/ABS_LEGALASSISTANCE_2023-24_00_02_04__efficiency-winners__deepseek-deepseek-v4-pro__default__off__review-always-2-repair.json"]},{"artifactClasses":["research-evidence"],"canonicalImportPath":"benchmark-results/all-csv-2026-05-09-independent/assets/ABS_LEGALASSISTANCE_2023-24_00_02_06/source.html","contentDigest":"sha256:1a9e102057b3e08993836397cef1b20b85a8aea4ac11fef21b6abb2fa8c0079e","dispositions":["duplicate-alias","import"],"groupSizeInSnapshot":17,"selectedMemberCount":2,"selectedPaths":["benchmark-results/all-csv-2026-05-09-independent/assets/ABS_LEGALASSISTANCE_2023-24_00_02_06/source.html","benchmark-results/prompt-efficiency-001-baseline/assets/ABS_LEGALASSISTANCE_2023-24_00_02_06/source.html"]},{"artifactClasses":["research-evidence"],"canonicalImportPath":"benchmark-results/all-csv-2026-05-09-independent/assets/ABS_PRISONERS_2023_00_02_01/produced.csv","contentDigest":"sha256:32f10de7db2edeef24447ae5ff0200595e943998d1f69cd5a698e98b46cd69ef","dispositions":["duplicate-alias","import"],"groupSizeInSnapshot":6,"selectedMemberCount":3,"selectedPaths":["benchmark-results/all-csv-2026-05-09-independent/assets/ABS_PRISONERS_2023_00_02_01/produced.csv","benchmark-results/all-csv-blank-filter-judge-2026-05-09-judgeable-remaining-3/assets/ABS_PRISONERS_2023_00_02_01/produced.csv","benchmark-results/all-csv-blank-filter-judge-2026-05-09-judgeable/assets/ABS_PRISONERS_2023_00_02_01/produced.csv"]},{"artifactClasses":["generation-source-code","ml-evidence"],"canonicalImportPath":"data/ml-prepass/corpus/2026-07-13-approvals-65/leakage-report.json","contentDigest":"sha256:55fae0957f732b80df921658e333bf4e926d348756e64b17330d2dc862da0fd5","dispositions":["duplicate-alias","import"],"groupSizeInSnapshot":2,"selectedMemberCount":2,"selectedPaths":["data/ml-prepass/corpus/2026-07-13-approvals-65/leakage-report.json","docs/prompt-efficiency/results/010-corpus/2026-07-13-approvals-65/leakage-report.json"]},{"artifactClasses":["example-operation-evidence","harvest-evidence"],"canonicalImportPath":"data/harvest/luna-canary/abs-luna-live-2026-07-29-retry-3/benchmark-units/luna-factorial-canary_sha256-db3a7a9fa0be53d31b5f1f1457ca31281ee28b6611c67bcf766432da97ede26c_standard-low-hints-off/attempt-1/score/diff.json","contentDigest":"sha256:7e85ae4f2c5aef13afee955ac0b5eec1cd5666c6f86cbe8657509f345214757f","dispositions":["duplicate-alias","import"],"groupSizeInSnapshot":3,"selectedMemberCount":2,"selectedPaths":["data/harvest/luna-canary/abs-luna-live-2026-07-29-retry-3/benchmark-units/luna-factorial-canary_sha256-db3a7a9fa0be53d31b5f1f1457ca31281ee28b6611c67bcf766432da97ede26c_standard-low-hints-off/attempt-1/score/diff.json","operations/evidence/cell-role-pipeline/cell-role-pipeline-luna-smoke-v1/payload/benchmark/75f9dbe5eed34432bf535c30/baseline/diff.json"]},{"artifactClasses":["workbook"],"canonicalImportPath":"abs-spreadsheets/people/crime-and-justice/recorded-crime-offenders/2023-24/6. Family and domestic violence.xlsx","contentDigest":"sha256:91db681481764fc676f68e4bff041e97f144b087f3b9657085d1189a3502de5f","dispositions":["duplicate-alias","import"],"groupSizeInSnapshot":2,"selectedMemberCount":2,"selectedPaths":["abs-spreadsheets/people/crime-and-justice/recorded-crime-offenders/2023-24/6. Family and domestic violence.xlsx","data/harvest/cache/sha256/91/91db681481764fc676f68e4bff041e97f144b087f3b9657085d1189a3502de5f.xlsx"]},{"artifactClasses":["generation-source-code","ml-evidence"],"canonicalImportPath":"data/ml-prepass/corpus/2026-07-09-approvals-20/leakage-report.json","contentDigest":"sha256:944d999de80d2ff88f5ca23077cc7ac86defc6111c3c08d8fb249089a2e96c02","dispositions":["duplicate-alias","import"],"groupSizeInSnapshot":4,"selectedMemberCount":2,"selectedPaths":["data/ml-prepass/corpus/2026-07-09-approvals-20/leakage-report.json","docs/prompt-efficiency/results/010-corpus/2026-07-09-approvals-20/leakage-report.json"]},{"artifactClasses":["workbook-estate-evidence"],"canonicalImportPath":"abs-spreadsheets/people/crime-and-justice/prisoners-australia/2024/Guide to finding data in the Prisoners in Australia 2024 publication tables.xlsx.meta.json","contentDigest":"sha256:ab378e274829de95fcb94278ab179b8f27d7f24fc78b52553ed2bad4504d4055","dispositions":["duplicate-alias","import"],"groupSizeInSnapshot":2,"selectedMemberCount":2,"selectedPaths":["abs-spreadsheets/people/crime-and-justice/prisoners-australia/2024/Guide to finding data in the Prisoners in Australia 2024 publication tables.xlsx.meta.json","abs-spreadsheets/people/crime-and-justice/prisoners-australia/latest-release/Guide to finding data in the Prisoners in Australia 2025 publication tables.xlsx.meta.json"]},{"artifactClasses":["ml-evidence"],"canonicalImportPath":"data/ml-prepass/gold-cohort/models/xgboost-header-direction-excl-gold-augmented.metadata.json","contentDigest":"sha256:b27ff9f9d6efb04762c86a94bbd657724663d106bdb95c4fa8ad20afb831dbbb","dispositions":["duplicate-alias","import"],"groupSizeInSnapshot":6,"selectedMemberCount":2,"selectedPaths":["data/ml-prepass/gold-cohort/models/xgboost-header-direction-excl-gold-augmented.metadata.json","data/ml-prepass/ml-llm-model-benchmark-50/models/xgboost-header-direction-model-benchmark-50-excl.metadata.json"]},{"artifactClasses":["workbook-estate-evidence"],"canonicalImportPath":"abs-spreadsheets/people/crime-and-justice/prisoners-australia/2019/4517do001_2019.xls.meta.json","contentDigest":"sha256:becf3a8904da5c39c63d1f637f0c478fd6a6fd6cafb92646104ed318e5fccdab","dispositions":["duplicate-alias","import"],"groupSizeInSnapshot":3,"selectedMemberCount":2,"selectedPaths":["abs-spreadsheets/people/crime-and-justice/prisoners-australia/2019/4517do001_2019.xls.meta.json","abs-spreadsheets/people/crime-and-justice/prisoners-australia/2020/1. Prisoner characteristics- Australia -Tables 1 to 13-.xls.meta.json"]},{"artifactClasses":["research-evidence"],"canonicalImportPath":"benchmark-results/all-csv-2026-05-09-independent/assets/ABS_LEGALASSISTANCE_2023-24_00_02_06/overlay.html","contentDigest":"sha256:c4caeb22f5e09d01e428fe1eed7a6527927adbb12990646561b4f234389aa0ad","dispositions":["duplicate-alias","import"],"groupSizeInSnapshot":14,"selectedMemberCount":3,"selectedPaths":["benchmark-results/all-csv-2026-05-09-independent/assets/ABS_LEGALASSISTANCE_2023-24_00_02_06/overlay.html","benchmark-results/all-csv-blank-filter-judge-2026-05-09-judgeable-remaining-3/assets/ABS_LEGALASSISTANCE_2023-24_00_02_06/overlay.html","benchmark-results/all-csv-blank-filter-judge-2026-05-09/assets/ABS_LEGALASSISTANCE_2023-24_00_02_06/overlay.html"]},{"artifactClasses":["generation-source-code","research-evidence"],"canonicalImportPath":"research-runs/cell-role-pipeline/semantic-map-v5-adjacent-year-offline-replay-2026-08-06/payload/role-aware-region-catalog-v5.test.ts.txt","contentDigest":"sha256:c86cd0cc6a57e1e57b89f3d5ff1fbbb1f78d57ab28f3f3ee99fbe7bd818fdcf2","dispositions":["duplicate-alias","import"],"groupSizeInSnapshot":2,"selectedMemberCount":2,"selectedPaths":["research-runs/cell-role-pipeline/semantic-map-v5-adjacent-year-offline-replay-2026-08-06/payload/role-aware-region-catalog-v5.test.ts.txt","scripts/experiments/cell-role-pipeline/role-aware-region-catalog-v5.test.ts"]},{"artifactClasses":["ml-evidence"],"canonicalImportPath":"data/ml-prepass/gold-cohort/models/xgboost-cell-role-excl-gold-augmented.metadata.json","contentDigest":"sha256:de5fb4641e111901271b32aa3ffeada0fd1f01c72976736b9709093ea2d2ad55","dispositions":["duplicate-alias","import"],"groupSizeInSnapshot":16,"selectedMemberCount":2,"selectedPaths":["data/ml-prepass/gold-cohort/models/xgboost-cell-role-excl-gold-augmented.metadata.json","data/ml-prepass/gold-cohort/models/xgboost-cell-role-excl-gold-w0.05.metadata.json"]},{"artifactClasses":["harvest-evidence","research-evidence"],"canonicalImportPath":"benchmark-results/2026-05-20T23-56-48-557Z/assets/AIHW_DRUGTREAT